{
  "$schema": "http://json-schema.org/draft-07/schema#",
  "$id": "https://aer.sequence.org/schemas/v1/OfflineIOU.schema.json",
  "title": "Partition-Tolerant Asynchronous Mutual Credit Clearing Specification (Offline Promissory Note)",
  "description": "Cryptographically authenticated bilateral promissory note enabling decentralized resource and energy allocation across network-partitioned or air-gapped environments (AER Section 6.3). Enforces monotonic counter validation and priority netting settlement upon topological network reconnection.",
  "type": "object",
  "required": [
    "schema_version",
    "iou_id",
    "debtor_node_id",
    "station_id",
    "energy_kwh",
    "unit_price_credit_b",
    "total_credit_b",
    "offline_risk_factor",
    "nonce",
    "timestamp",
    "expiry_timestamp",
    "debtor_signature"
  ],
  "additionalProperties": false,
  "properties": {
    "schema_version": {
      "type": "string",
      "pattern": "^1\\.[0-9]+\\.[0-9]+$",
      "description": "Semantic versioning string of this formal schema specification (e.g. 1.0.0)."
    },
    "iou_id": {
      "type": "string",
      "pattern": "^0x[a-fA-F0-9]{64}$",
      "description": "Unique 32-byte cryptographic digest identifying this offline credit clearing note."
    },
    "debtor_node_id": {
      "type": "string",
      "pattern": "^0x[a-fA-F0-9]{40}$",
      "description": "EVM address of the debtor autonomous node accepting liability for consumed resources."
    },
    "station_id": {
      "type": "string",
      "pattern": "^0x[a-fA-F0-9]{40}$",
      "description": "EVM address of the creditor node or utility provider holding the claim."
    },
    "energy_kwh": {
      "type": "number",
      "exclusiveMinimum": 0.0,
      "description": "Quantified physical electrical energy transferred, measured in kilowatt-hours."
    },
    "unit_price_credit_b": {
      "type": "string",
      "pattern": "^[0-9]+$",
      "description": "Atomic units of Credit B charged per unit of physical resource (1 kWh)."
    },
    "total_credit_b": {
      "type": "string",
      "pattern": "^[1-9][0-9]*$",
      "description": "Cumulative principal liability denominated in atomic Credit B units."
    },
    "offline_risk_factor": {
      "type": "number",
      "minimum": 1.0,
      "maximum": 5.0,
      "description": "Risk multiplier gamma_offline (>= 1.0) compensating the creditor node for network partition duration and settlement delay."
    },
    "nonce": {
      "type": "integer",
      "minimum": 0,
      "description": "Strictly monotonic sequence counter maintained by the debtor node to prevent double-clearing."
    },
    "timestamp": {
      "type": "integer",
      "minimum": 1700000000,
      "description": "Unix epoch timestamp in seconds recording note creation during network partition."
    },
    "expiry_timestamp": {
      "type": "integer",
      "minimum": 1700000000,
      "description": "Maturity timestamp after which the creditor node may initiate priority netting across on-chain task inflows."
    },
    "debtor_signature": {
      "type": "string",
      "pattern": "^0x[a-fA-F0-9]{130}$",
      "description": "65-byte ECDSA cryptographic signature generated by the debtor over the canonical note hash."
    }
  }
}
